{
  "version": "visual-1",
  "trace_id": "trace_64fac4db-71f7-4aab-8f30-3c92ca86337f",
  "template_selection": {
    "family": "generic",
    "record": null,
    "candidates": [
      {
        "family": "generic",
        "eligible": true,
        "reason": "No custom/brand/reference template requested; native catalog is selected explicitly."
      },
      {
        "family": "free_layout",
        "eligible": true,
        "reason": "Native geometry compiler is available as explicit alternative."
      }
    ],
    "fallback": "fail on incompatible capacity",
    "status": "selected"
  },
  "design_tokens": {
    "font": "Noto Sans CJK SC",
    "foreground": "192C32",
    "background": "F6F4EE",
    "accent": "147C80",
    "shape_language": "native_editable",
    "image_treatment": "contain_without_crop",
    "decoration_density": "minimal",
    "provenance": {
      "font": "caller override or declared native renderer font",
      "colors": "caller override or explicit product default"
    },
    "template_tokens": null
  },
  "asset_declarations": [
    {
      "asset_id": "asset_53df89e2-f082-4680-9411-8abc446ad30b",
      "source_id": "source_2ce3a059-f498-491c-9f3c-15a2636283d9",
      "source_type": "user",
      "path": "/runtime/visual-validation/declared-image.png",
      "license": "test-fixture-authorized",
      "usage_status": "authorized",
      "authorization_basis": "Artificial fixture authored for product integration verification",
      "attribution": null,
      "source_url": null,
      "source_refs": [],
      "deliberate_reuse": false,
      "request_metadata": null,
      "transform_history": []
    }
  ],
  "resolved_assets": {
    "status": "resolved",
    "entries": [
      {
        "asset_id": "asset_53df89e2-f082-4680-9411-8abc446ad30b",
        "source_id": "source_2ce3a059-f498-491c-9f3c-15a2636283d9",
        "source_type": "user",
        "source_locator": "/runtime/visual-validation/declared-image.png",
        "source_url": null,
        "path": "/runtime/assets/39d342647263fb6293f038dd7d983b606c79469f62f9cbdee673b6fd76b48e0e.png",
        "sha256": "39d342647263fb6293f038dd7d983b606c79469f62f9cbdee673b6fd76b48e0e",
        "bytes": 552,
        "mime_type": "image/png",
        "width_px": 320,
        "height_px": 160,
        "inspection": {
          "asset_kind": "image",
          "sha256": "39d342647263fb6293f038dd7d983b606c79469f62f9cbdee673b6fd76b48e0e",
          "bytes": 552,
          "format": "PNG",
          "mime_type": "image/png",
          "width": 320,
          "height": 160,
          "mode": "RGB",
          "frame_count": 1,
          "aspect_ratio": 2.0,
          "dpi": null,
          "color_profile_sha256": null,
          "perceptual_hash": {
            "algorithm": "dhash-9x8-white-composite-frame0",
            "value": "0000000000000000"
          },
          "has_alpha": false,
          "dominant_colors": [
            {
              "color": "#1A5043",
              "fraction": 1.0
            }
          ],
          "dominant_color_method": "128px thumbnail, white alpha composite, Pillow quantize 6",
          "semantic_status": "not_inferred",
          "ocr_status": "unsupported",
          "issues": [
            {
              "code": "IMAGE_OCR_NOT_EXECUTED",
              "requirement_ids": [
                "IN-011"
              ],
              "message": "仅提取像素元数据和主色，未声称提取图片文字、语义元素或可编辑布局。"
            }
          ]
        },
        "license": "test-fixture-authorized",
        "usage_status": "authorized",
        "authorization_basis": "Artificial fixture authored for product integration verification",
        "attribution": null,
        "transform_history": [],
        "request_metadata": null,
        "source_refs": [],
        "semantic_status": "caller_role_declared_not_independently_reviewed",
        "deliberate_reuse": false,
        "cache_status": "complete_and_hash_verified"
      }
    ],
    "issues": [],
    "duplicate_groups": [],
    "boundary": "Real bytes/hash/MIME/pixels and caller authorization checked; semantic appropriateness, watermark, perceptual duplicates and full AST acceptance remain unproven."
  },
  "decision_traces": [
    {
      "trace_id": "trace_64fac4db-71f7-4aab-8f30-3c92ca86337f",
      "node_id": "DEC-028",
      "input": {
        "template_ref": null,
        "constraints": {
          "hard": [
            {
              "constraint_id": "candidate_9c31a0bf-826b-49f7-ae61-79da11ccc1d1",
              "field": "page_count",
              "value": 6,
              "source": {
                "kind": "user_instruction",
                "reference": "raw_text:13:15"
              }
            },
            {
              "constraint_id": "candidate_335efc9a-bca8-465b-99f1-0f7f535a9f6a",
              "field": "language",
              "value": "zh-CN",
              "source": {
                "kind": "user_instruction",
                "reference": "raw_text:15:17"
              }
            }
          ],
          "soft": [
            {
              "constraint_id": "candidate_295e3d19-cf33-48d7-af03-35788ff33ab9",
              "field": "page_count",
              "value": 6,
              "source": {
                "kind": "user_instruction",
                "reference": "runtime_preferences.page_count"
              },
              "disposition": "applied",
              "applied_value": 6,
              "handling_reason": "Selected by DEC-002 and within current execution subset."
            }
          ],
          "defaults": [
            {
              "constraint_id": "system_default.page_count",
              "field": "page_count",
              "value": 10,
              "source": {
                "kind": "system_default",
                "reference": "DEC-002 versioned runtime defaults"
              },
              "used": false,
              "handling_reason": "DEC-002 selects defaults only without higher precedence and within current execution support."
            },
            {
              "constraint_id": "system_default.language",
              "field": "language",
              "value": "zh-CN",
              "source": {
                "kind": "system_default",
                "reference": "DEC-002 versioned runtime defaults"
              },
              "used": false,
              "handling_reason": "DEC-002 selects defaults only without higher precedence and within current execution support."
            },
            {
              "constraint_id": "system_default.aspect_ratio",
              "field": "aspect_ratio",
              "value": "16:9",
              "source": {
                "kind": "system_default",
                "reference": "DEC-002 versioned runtime defaults"
              },
              "used": true,
              "handling_reason": "DEC-002 selects defaults only without higher precedence and within current execution support."
            },
            {
              "constraint_id": "system_default.minimum_font_size",
              "field": "minimum_font_size",
              "value": 16,
              "source": {
                "kind": "system_default",
                "reference": "DEC-002 versioned runtime defaults"
              },
              "used": true,
              "handling_reason": "DEC-002 selects defaults only without higher precedence and within current execution support."
            },
            {
              "constraint_id": "system_default.template",
              "field": "template",
              "value": null,
              "source": {
                "kind": "system_default",
                "reference": "DEC-002 versioned runtime defaults"
              },
              "used": true,
              "handling_reason": "DEC-002 selects defaults only without higher precedence and within current execution support."
            },
            {
              "constraint_id": "system_default.brand",
              "field": "brand",
              "value": null,
              "source": {
                "kind": "system_default",
                "reference": "DEC-002 versioned runtime defaults"
              },
              "used": true,
              "handling_reason": "DEC-002 selects defaults only without higher precedence and within current execution support."
            },
            {
              "constraint_id": "system_default.output_formats",
              "field": "output_formats",
              "value": [
                "pptx",
                "pdf",
                "png"
              ],
              "source": {
                "kind": "system_default",
                "reference": "DEC-002 versioned runtime defaults"
              },
              "used": false,
              "handling_reason": "DEC-002 selects defaults only without higher precedence and within current execution support."
            },
            {
              "constraint_id": "system_default.audience",
              "field": "audience",
              "value": null,
              "source": {
                "kind": "system_default",
                "reference": "DEC-002 versioned runtime defaults"
              },
              "used": true,
              "handling_reason": "DEC-002 selects defaults only without higher precedence and within current execution support."
            },
            {
              "constraint_id": "system_default.scenario",
              "field": "scenario",
              "value": null,
              "source": {
                "kind": "system_default",
                "reference": "DEC-002 versioned runtime defaults"
              },
              "used": true,
              "handling_reason": "DEC-002 selects defaults only without higher precedence and within current execution support."
            },
            {
              "constraint_id": "system_default.duration",
              "field": "duration",
              "value": null,
              "source": {